{
  "name": "LocalSend",
  "slug": "localsend",
  "description": "Open-source AirDrop alternative , share files and messages with nearby devices over local network, cross-platform",
  "website": "https://localsend.org",
  "platform": "macOS",
  "architecture": "universal",
  "bundle_id": "org.localsend.localsendApp",
  "category": "utilities",
  "license": "free",
  "min_os": "macOS 11.0",
  "auto_updates": true,
  "skip": false,
  "version_check": {
    "method": "github_api",
    "url": "https://api.github.com/repos/localsend/localsend/releases/latest",
    "extraction": {
      "type": "json_path",
      "path": "tag_name"
    }
  },
  "download": {
    "method": "redirect_url",
    "url": "https://localsend.org/download",
    "file_type": "dmg",
    "note": "Landing/download page URL; MacUpdater follows redirects to the archive."
  },
  "changelog": {
    "method": "github_api",
    "url": "https://api.github.com/repos/localsend/localsend/releases/latest"
  },
  "release_date": {
    "method": "github_api",
    "field": "published_at"
  },
  "last_updated": "2026-06-22"
}
