{
  "name": "Signal",
  "slug": "signal",
  "description": "Encrypted messaging and calling app",
  "website": "https://signal.org",
  "platform": "macOS",
  "architecture": "universal",
  "min_os": "macOS 11",
  "auto_updates": true,
  "version_check": {
    "method": "yaml_api",
    "url": "https://updates.signal.org/desktop/latest-mac.yml",
    "extraction": {
      "type": "yaml_key",
      "pattern": "version"
    },
    "headers": {}
  },
  "download": {
    "method": "yaml_field",
    "file_type": "dmg",
    "headers": {},
    "url": "https://updates.signal.org/desktop/{filename}"
  },
  "changelog": {
    "method": "scrape",
    "url": "https://signal.org/blog/"
  },
  "release_date": {
    "method": "yaml_field",
    "field": "releaseDate (ISO 8601)"
  },
  "notes": "Uses Electron updater YAML manifest. Filename extracted from YAML 'files' array , pick the universal dmg entry. Separate arch builds available (x64, arm64, universal).",
  "last_updated": "2026-06-21",
  "$schema": "https://raw.githubusercontent.com/evenwebb/macupdater-profiles/main/schema.json",
  "category": "messaging",
  "license": "free",
  "skip": false,
  "bundle_id": "org.whispersystems.signal-desktop"
}
