{
  "name": "Whisky",
  "slug": "whisky",
  "description": "Modern Wine wrapper for macOS , run Windows games and apps on Apple Silicon with a native SwiftUI interface",
  "website": "https://getwhisky.app",
  "platform": "macOS",
  "architecture": "universal",
  "bundle_id": "com.isaacmarovitz.Whisky",
  "category": "gaming",
  "license": "free",
  "min_os": "macOS 14.0",
  "auto_updates": true,
  "skip": false,
  "version_check": {
    "method": "github_api",
    "url": "https://api.github.com/repos/Whisky-App/Whisky/releases/latest",
    "extraction": {
      "type": "json_path",
      "path": "tag_name"
    }
  },
  "download": {
    "method": "redirect_url",
    "url": "https://getwhisky.app/download",
    "file_type": "dmg",
    "note": "Landing/download page URL; MacUpdater follows redirects to the archive."
  },
  "changelog": {
    "method": "github_api",
    "url": "https://api.github.com/repos/Whisky-App/Whisky/releases/latest"
  },
  "release_date": {
    "method": "github_api",
    "field": "published_at"
  },
  "last_updated": "2026-06-22"
}
