{
  "name": "Caprine",
  "slug": "caprine",
  "description": "Elegant third-party Facebook Messenger desktop app , dark mode, privacy-focused, and keyboard shortcuts",
  "website": "https://sindresorhus.com/caprine",
  "platform": "macOS",
  "architecture": "universal",
  "bundle_id": "com.sindresorhus.caprine",
  "category": "messaging",
  "license": "free",
  "min_os": "macOS 10.15",
  "auto_updates": true,
  "skip": false,
  "version_check": {
    "method": "github_api",
    "url": "https://api.github.com/repos/sindresorhus/caprine/releases/latest",
    "extraction": {
      "type": "json_path",
      "path": "tag_name"
    }
  },
  "download": {
    "method": "redirect_url",
    "url": "https://github.com/sindresorhus/caprine/releases/latest",
    "file_type": "dmg",
    "note": "Landing/download page URL; MacUpdater follows redirects to the archive."
  },
  "changelog": {
    "method": "github_api",
    "url": "https://api.github.com/repos/sindresorhus/caprine/releases/latest"
  },
  "release_date": {
    "method": "github_api",
    "field": "published_at"
  },
  "last_updated": "2026-06-22",
  "icons": {
    "direct_url": "https://raw.githubusercontent.com/evenwebb/macupdater-profiles/main/icons/caprine.png"
  }
}
