{
  "name": "Joplin",
  "slug": "joplin",
  "description": "Open source note-taking app , capture your thoughts and access them from any device",
  "website": "https://joplinapp.org",
  "platform": "macOS",
  "architecture": "separate",
  "bundle_id": "net.cozic.joplin",
  "category": "notes-writing",
  "license": "free",
  "min_os": "macOS 10.14",
  "auto_updates": true,
  "skip": false,
  "version_check": {
    "method": "github_api",
    "url": "https://api.github.com/repos/laurent22/joplin/releases/latest",
    "extraction": {
      "type": "json_path",
      "path": "tag_name"
    },
    "notes": "Separate Intel (latest-mac.yml) and Apple Silicon (latest-mac-arm64.yml) builds via electron-updater"
  },
  "download": {
    "method": "redirect_url",
    "url": "https://joplinapp.org/download",
    "file_type": "dmg",
    "note": "Landing/download page URL; MacUpdater follows redirects to the archive."
  },
  "changelog": {
    "method": "github_api",
    "url": "https://api.github.com/repos/laurent22/joplin/releases/latest"
  },
  "release_date": {
    "method": "github_api",
    "field": "published_at"
  },
  "last_updated": "2026-06-22"
}
