{
  "name": "ChatGPT Classic",
  "slug": "chatgpt",
  "description": "OpenAI ChatGPT Classic desktop app (the previous ChatGPT macOS client)",
  "website": "https://openai.com/chat",
  "platform": "macOS",
  "architecture": "arm64",
  "min_os": "14.0",
  "auto_updates": true,
  "version_check": {
    "method": "sparkle_appcast",
    "url": "https://persistent.oaistatic.com/sidekick/public/sparkle_public_appcast.xml",
    "extraction": {
      "type": "sparkle_xml",
      "version_field": "sparkle:shortVersionString",
      "build_field": "sparkle:version",
      "note": "Feed title is ChatGPT Classic. Prefers Sparkle enclosure (ChatGPT_Classic.pkg).",
      "example": "1.2026.184"
    },
    "headers": {}
  },
  "download": {
    "method": "sparkle_enclosure",
    "url": "https://persistent.oaistatic.com/sidekick/public/ChatGPT_Classic.pkg",
    "file_type": "pkg",
    "headers": {},
    "note": "Classic ships as a .pkg that stages ChatGPT Classic.app.zip; MacUpdater expands the pkg and installs the embedded .app without sudo when possible."
  },
  "changelog": {
    "method": "sparkle_release_notes",
    "url": "included in sparkle:releaseNotesLink field of appcast item"
  },
  "release_date": {
    "method": "sparkle_pub_date",
    "field": "pubDate in appcast <item>"
  },
  "notes": "Renamed to ChatGPT Classic when OpenAI shipped the new ChatGPT.app (bundle com.openai.codex). This profile tracks com.openai.chat only.",
  "last_updated": "2026-07-31",
  "$schema": "https://raw.githubusercontent.com/evenwebb/macupdater-profiles/main/schema.json",
  "category": "ai-tools",
  "license": "free",
  "skip": false,
  "bundle_id": "com.openai.chat",
  "match": {
    "name_aliases": [
      "ChatGPT Classic",
      "ChatGPT"
    ]
  },
  "icons": {
    "direct_url": "https://raw.githubusercontent.com/evenwebb/macupdater-profiles/main/icons/chatgpt.png"
  }
}
