{
  "name": "Audio Hijack",
  "slug": "audio-hijack",
  "description": "Record any application's audio on your Mac , perfect for podcasts, streaming, and VoIP calls",
  "website": "https://rogueamoeba.com/audiohijack",
  "platform": "macOS",
  "architecture": "universal",
  "bundle_id": "com.rogueamoeba.audiohijack",
  "category": "media",
  "license": "paid",
  "min_os": "macOS 14.4.0",
  "auto_updates": true,
  "skip": false,
  "version_check": {
    "method": "json_api",
    "url": "https://formulae.brew.sh/api/cask/audio-hijack.json",
    "extraction": {
      "type": "json_path",
      "path": "version",
      "download_path": "url",
      "example": "4.5.9"
    },
    "headers": {}
  },
  "download": {
    "method": "direct_url",
    "url": "https://cdn.rogueamoeba.com/audiohijack/download/AudioHijack.zip",
    "file_type": "zip",
    "headers": {}
  },
  "changelog": {
    "method": "web_scrape",
    "url": "https://rogueamoeba.com/audiohijack/releasenotes"
  },
  "last_updated": "2026-06-22",
  "icons": {
    "direct_url": "https://raw.githubusercontent.com/evenwebb/macupdater-profiles/main/icons/audio-hijack.png"
  }
}
