{
  "name": "Hammerspoon",
  "slug": "hammerspoon",
  "description": "Staggeringly powerful macOS automation tool , bridge between Lua scripting engine and macOS APIs for window management, keyboard shortcuts, and more",
  "website": "https://www.hammerspoon.org",
  "platform": "macOS",
  "architecture": "universal",
  "bundle_id": "org.hammerspoon.Hammerspoon",
  "category": "utilities",
  "license": "free",
  "min_os": "macOS 13.0",
  "auto_updates": true,
  "skip": false,
  "version_check": {
    "method": "github_api",
    "url": "https://api.github.com/repos/Hammerspoon/hammerspoon/releases/latest",
    "extraction": {
      "type": "json_path",
      "path": "tag_name"
    }
  },
  "download": {
    "method": "redirect_url",
    "url": "https://github.com/Hammerspoon/hammerspoon/releases/latest",
    "file_type": "dmg",
    "note": "Landing/download page URL; MacUpdater follows redirects to the archive."
  },
  "changelog": {
    "method": "github_api",
    "url": "https://api.github.com/repos/Hammerspoon/hammerspoon/releases/latest"
  },
  "release_date": {
    "method": "github_api",
    "field": "published_at"
  },
  "last_updated": "2026-06-22",
  "icons": {
    "direct_url": "https://raw.githubusercontent.com/evenwebb/macupdater-profiles/main/icons/hammerspoon.png"
  }
}
