{
  "name": "Lapce",
  "slug": "lapce",
  "description": "Lightning-fast and powerful code editor written in Rust with native GUI and remote development support",
  "website": "https://lapce.dev",
  "platform": "macOS",
  "architecture": "universal",
  "bundle_id": "dev.lapce.lapce",
  "category": "developer-tools",
  "license": "free",
  "min_os": "macOS 11.0",
  "auto_updates": true,
  "skip": false,
  "version_check": {
    "method": "github_api",
    "url": "https://api.github.com/repos/lapce/lapce/releases/latest",
    "extraction": {
      "type": "json_path",
      "path": "tag_name"
    }
  },
  "download": {
    "method": "redirect_url",
    "url": "https://lapce.dev",
    "file_type": "dmg",
    "note": "Landing/download page URL; MacUpdater follows redirects to the archive."
  },
  "changelog": {
    "method": "github_api",
    "url": "https://api.github.com/repos/lapce/lapce/releases/latest"
  },
  "release_date": {
    "method": "github_api",
    "field": "published_at"
  },
  "last_updated": "2026-06-22"
}
